{
    "$schema": "http://json-schema.org/draft-07/schema#",
    "properties": {
        "address": {
            "type": "string"
        },
        "descriptions": {
            "type": "string"
        },
        "id": {
            "type": "string"
        },
        "tags": {
            "items": {
                "type": "string"
            },
            "type": "array"
        },
        "title": {
            "type": "string"
        }
    },
    "type": "object"
}
